{
  "schemaVersion": "1.0.0",
  "bundleVersion": "fixture-1",
  "metadata": {
    "generatedAt": "2026-07-27T00:00:00.000Z",
    "asOf": "2026-07-20T00:00:00.000Z",
    "sourceDatasetIds": ["project-portfolio-generated-fixture-demo"],
    "administrativeCodeVersion": "daklak-labels-v1",
    "classification": "public",
    "producer": "phase3-manual-fixture",
    "description": "Drift-guard fixture — hoàn toàn hư cấu, không phải dữ liệu vận hành thật."
  },
  "datasets": {
    "agencies": [
      {
        "id": "agency-fixture-001",
        "name": "Sở Kế hoạch và Đầu tư (fixture)",
        "type": "managing-authority"
      }
    ],
    "contractors": [{ "id": "contractor-fixture-001", "name": "Công ty xây dựng ABC (fixture)" }],
    "projects": [
      {
        "id": "project-fixture-001",
        "code": "FIX-001",
        "name": "Dự án minh hoạ (fixture)",
        "description": "Fixture cho drift-guard test.",
        "sector": "transport",
        "status": "active",
        "priority": "medium",
        "managingAuthorityId": "agency-fixture-001",
        "investorId": "agency-fixture-001",
        "approvedBudget": 10000000000,
        "disbursedAmount": 2000000000,
        "overallProgress": 20,
        "plannedProgress": 25,
        "financialProgress": 20,
        "administrativeAreaCodes": ["22165"],
        "dataUpdatedAt": "2026-07-20T00:00:00.000Z",
        "dataOwner": "Fixture",
        "sourceDatasetId": "project-portfolio-generated-fixture-demo",
        "confidence": "medium",
        "verificationStatus": "validated-automatically"
      }
    ],
    "workPackages": [],
    "milestones": [],
    "projectIssues": [],
    "progressSnapshots": [],
    "evidence": [],
    "referenceDocuments": []
  }
}
